Title,Source,Published Date
Polls open in second round of Portugal presidential election - Al Jazeera,Al Jazeera English,2026-02-08
3 takeaways from BYU’s loss to No. 8 Houston - Deseret News,Deseret News,2026-02-08
Andrei Arlovksi bludgeons Ben Rothwell in bloody BKFC heavyweight title fight at Knucklemania 6 - Yahoo Sports,Yahoo Entertainment,2026-02-08
"Horoscope for Sunday, February 08, 2026 - Chicago Sun-Times",Suntimes.com,2026-02-08
"James Harden makes mark in Cavs’ debut, helping Cleveland rally from behind in 132-126 win - Cleveland.com",cleveland.com,2026-02-08
